{
  "$schema": "https://json-schema.org/draft/2020-12/schema",
  "$id": "https://github.com/49g-holding/49GAION-protocol/library/contracts/release-notice.schema.json",
  "title": "49GAION Library - release notice",
  "description": "A notice from a design stage to the stage after it, sent on every filing of a decided release. It points to the filed release by reference; it never carries release text, atom text or the name of a person. notice_id is the sending stage's prefix, 'N-', and the SHA-256 of the canonical notice without notice_id (keys sorted, separators ',' and ':', UTF-8, non-ASCII kept). A stage's own notice contract may narrow any field (a pattern, a value, a count); it never adds or removes one.",
  "type": "object",
  "additionalProperties": false,
  "required": ["notice_id", "from", "to", "release", "rests_on", "filed_ref", "final_status", "final_status_ref", "supersedes", "answers", "sent_at"],
  "properties": {
    "notice_id": { "type": "string", "pattern": "^[A-Z]{2,8}N-[a-f0-9]{64}$" },
    "from": { "type": "string", "pattern": "^(\\[ORG\\]|[0-9A-Za-z]+)AIOC-[A-Z0-9]{2,8}$", "description": "The sending stage." },
    "to": { "type": "string", "pattern": "^(\\[ORG\\]|[0-9A-Za-z]+)AIOC-[A-Z0-9]{2,8}$", "description": "The next stage." },
    "release": {
      "type": "object",
      "additionalProperties": false,
      "required": ["release_id", "version", "manifest_sha256"],
      "properties": {
        "release_id": { "type": "string", "pattern": "^[A-Z]+-?[a-f0-9]{64}$" },
        "version": { "type": "string", "minLength": 1 },
        "manifest_sha256": { "type": "string", "pattern": "^[a-f0-9]{64}$" }
      }
    },
    "rests_on": {
      "type": "array",
      "description": "The decided releases this release was designed from; empty for a stage that rests on sources only.",
      "items": {
        "type": "object",
        "additionalProperties": false,
        "required": ["release_id", "manifest_sha256"],
        "properties": {
          "release_id": { "type": "string", "pattern": "^[A-Z]+-?[a-f0-9]{64}$" },
          "manifest_sha256": { "type": "string", "pattern": "^[a-f0-9]{64}$" }
        }
      }
    },
    "filed_ref": {
      "type": "object",
      "additionalProperties": false,
      "required": ["source_id", "version", "sha256"],
      "description": "The filed copy of the release in Source Lifecycle, as its filing receipt names it.",
      "properties": {
        "source_id": { "type": "string", "minLength": 1 },
        "version": { "type": "string", "minLength": 1 },
        "sha256": { "type": "string", "pattern": "^[a-f0-9]{64}$" }
      }
    },
    "final_status": { "type": "string", "minLength": 1, "description": "The decided final status, in the sending stage's own words; only a decided release is announced." },
    "final_status_ref": { "type": "string", "minLength": 1, "description": "The decision reference in Source Lifecycle." },
    "supersedes": {
      "oneOf": [
        { "type": "string", "pattern": "^[A-Z]+-?[a-f0-9]{64}$" },
        { "type": "null" }
      ]
    },
    "answers": {
      "type": "array",
      "uniqueItems": true,
      "items": { "type": "string", "pattern": "^[A-Z]{2,8}R-[0-9]+$" },
      "description": "The design returns this release answers; may be empty."
    },
    "sent_at": { "type": "string", "format": "date-time" }
  }
}
